Video-Typ,Nummer,Titel,URL
Hauptvideo,,Lustige Geschichten mit Spielzeug für Kinder - Videos von Vlad und Niki,https://www.youtube.com/watch?v=-dYFcH6d6WQ&pp=ygUMS2luZGVydmlkZW9z
Empfehlung,2,Löschmeister ⭐ Feuerwehr im Einsatz  [ Kindervideos | Kinderfilme ] #telekids,
Empfehlung,3,Vorsicht! - Lauf nicht auf die Straße! | Sicher spielen  | Little Angel Deutsch,
Empfehlung,4,Bonna und die bunten Rutschen - Kindervideo - deutsch,
Empfehlung,5,Kindervideo auf Deutsch. Smarta und Spotty gehen ins Schwimmbad. Zeichentrickfilm.,
Empfehlung,6,Spielspaß mit Barbie und L.O.L. Puppen - 4 Kindervideos mit Ayça,
Empfehlung,7,Spielspaß mit Peppa Wutz und Nicole. Spielzeug Videos für Kinder. Wir spielen und lernen,
Empfehlung,8,Monster In das Dunkel | Halloween Lied | Reimt sich | Kinder Videos,
Empfehlung,9,Doktor Spiele mit Bianca. Kinder Videos. 2 Folgen am Stück | Ich heiße Bianca,
Empfehlung,10,Schneespaß im Kindergarten - Leo Lausemaus,
Empfehlung,11,Eeny Meeny Miny Moe | Deutsch Kinderlied | Lied für Babys | Preschool Song | Nursery Rhymes,
